### ISSUE TITLE
possible NAT issue

### ISSUE THREAD

**Issue by markfoodyburton** [firehol/firehol#390]
Some web sites SOMETIMES 'hang' - always in the same way:
```
curl -v https://.........
*   Trying 104.20.44.7...
* TCP_NODELAY set
* Connected to www.random.org (104.20.44.7) port 443 (#0)
* ALPN, offering h2
* ALPN, offering http/1.1
* Cipher selection: ALL:!EXPORT:!EXPORT40:!EXPORT56:!aNULL:!LOW:!RC4:@STRENGTH
* successfully set certificate verify locations:
*   CAfile: /etc/ssl/cert.pem
  CApath: none
* TLSv1.2 (OUT), TLS handshake, Client hello (1):
^C
```
(At this point, it hangs, waiting for the SERVER reply).

I have:
Local machines 192.162.168.0/24
All connected to a switch, with router/gateway 192.168.1.1
The router also runs a VPN,
2 'router/modems' are connected to the same switch, on different subnets: 192.168.4.4 and 192.168.5.5
In the router, I use macvlan's to isolate the modems
The VPN then uses these two macvlans to build a 'bonded' VPN. (see https://github.com/zehome/MLVPN)

At the other end of the VPN is a public server.

I am running firehol on BOTH 192.168.1.1 AND the remote public server.
I am running link_balance on 192.168.1.1

Testing the same web sites from 192.168.1.1 _ALWAYS_ works (using the VPN). 
Testing from a machine on my local network _OFTEN_ fails, as above !!! But not always !

On 192.168.1.1 
I run the following firehol.conf
```
version 6
connmark 0x1 interface mlvpn0
connmark 0x4 interface macvlan4
connmark 0x5 interface macvlan5

snat4 to 10.42.42.2  outface mlvpn0 src 192.168.1.0/24
snat4 to 192.168.5.5 outface macvlan5 src 192.168.1.0/24
snat4 to 192.168.4.5 outface macvlan4 src 192.168.1.0/24

interface eth0 lan
    policy accept

interface mlvpn0 network
    protection strong
    client all  accept
    server ssh accept

interface macvlan4 net4
    protection strong
    client all accept
  
interface macvlan5 net5
    protection strong
    client all accept

router lan2net4 inface eth0 outface macvlan4
    route all accept

router lan2net5 inface eth0 outface macvlan5
    route all accept
    
router lan2net inface eth0 outface mlvpn0
    route all accept
```

My link-balance.conf is

```
gateway ADSL5 dev macvlan5 gw 192.168.5.5
gateway LTE4 dev macvlan4 gw 192.168.4.4
gateway MLVPN dev mlvpn0 gw 10.42.42.1

table ADSL5
	default via ADSL5

table LTE4
	default via LTE4

table MLVPN
	default via MLVPN

# this is the main system routing table
table main
	default via ADSL5 weight 0
	default via LTE4 weight 0
	default via MLVPN weight 10

policy
        connmark 0x4 table LTE4 
        connmark 0x5 table ADSL5
        connmark 0x1 table MLVPN
 	rules src gw-src-ips LTE4 table LTE4
      	rules src gw-src-ips ADSL5 table ADSL5
      	rules src gw-src-ips MLVPN table MLVPN
```

(If the VPN goes down, I'd want link-balance to fall back to a 'balance' mode between ADSL5 and LTE4)

Then, on the public server I have the following firehol.conf
```
version 6

# for a web server, add dnat4 to 10.42.42.2 proto tcp dport 80 dst 54.37.16.242

interface ens3 inet
  protection strong
  client all accept
  server ssh accept

interface mlvpn0 vpn                            
  policy accept


router inet2vpn inface ens3 outface mlvpn0 
  client all accept

router vpn2inet inface mlvpn0 outface ens3 
  masquerade
  route all accept

router vpn2vpn inface mlvpn0 outface mlvpn0
  masquerade
```

I have _NOTHING_ in my logs associated with the 'failed' web site loading. I am at a loss to see what else I can do to debug this !
Can you help? Can you point to where I might have gone wrong

**Comment by markfoodyburton** [comment]
tshark gives me some more information, this looks like a fragmentation issue
 
when it fails, I have:
```
 TLSv1.2 4178 Server Hello, Certificate, Server Key Exchange, Server Hello Done
 ICMP 590 Destination unreachable (Fragmentation needed)
```

which gets retransmitted as 
```
TCP 1514 [TCP Retransmission] 443 → 50544 [ACK] Seq=1 Ack=518 Win=15544 Len=1448 TSval=4172402208 TSecr=3635626254
```

But the length is still to large (the mlvpn has MTU:  1438). I dont understand why this doesn't work when the request comes from within my network, where as it does work when it comes from 192.168.1.1:
```
    TLSv1 569 Client Hello
    TCP 52 443 → 50522 [ACK] Seq=1 Ack=518 Win=15544 Len=0 TSval=4175547430 TSecr=2642284372
    TLSv1.2 1436 Server Hello
    TCP 1436 443 → 50522 [ACK] Seq=1385 Ack=518 Win=15544 Len=1384 TSval=4175547434 TSecr=2642284372 [TCP segment of a reassembled PDU]
    TLSv1.2 1401 Certificate, Server Key Exchange, Server Hello Done
```

In this case, the length is only 1384, and we're happy.... but why !

**Comment by markfoodyburton** [comment]
RTFM : https://firehol.org/firehol-manual/firehol-tcpmss/
