### ISSUE TITLE
TPROXY support 

### ISSUE THREAD

**Issue by Mihara** [firehol/firehol#25]
To make this short, in IPv6 settings, Squid is capable of transparent proxying in a fashion which does not rely on NAT, by using this mechanism: http://wiki.squid-cache.org/Features/Tproxy4 -- example usage with IPv6 can be seen at http://version6.ru/tproxy

Currently, FireHOL does not appear to support generating such statements, and it would be very nice if it could do this, since I'm completely out of my depth attempting to do this manually.

**Comment by ktsaou** [comment]
Here is what firehol does:

where you say `tproxy4 80 port 3128 inface eth0`, firehol executes these commands:

```bash
# FireHOL [:] > tproxy4 80 port 3128 inface eth0
# \/\/\/\/\/\/\/\/\/\/\/\/\/\/\/\/\/\/\/\/\/\/\/\/\/\/\/\/\/\/\/\/\/\/\/\/\/\/\/
# Cmd Line : 1@Interactive User Input
# Command  : tproxy4 80 port 3128 inface eth0

# Rules for catching routed tcp/80 traffic

# Creating chain 'in_tproxy.1' under 'PREROUTING' in table 'mangle'
/sbin/iptables -t mangle -N in_tproxy.1
/sbin/iptables -t mangle -A PREROUTING -i eth0 -p tcp --dport 80 -j in_tproxy.1

# Creating chain 'in_tproxy.1.divert' under 'in_tproxy.1' in table 'mangle'
/sbin/iptables -t mangle -N in_tproxy.1.divert
/sbin/iptables -t mangle -A in_tproxy.1 -p tcp -m socket -j in_tproxy.1.divert
/sbin/iptables -t mangle -A in_tproxy.1.divert -j MARK --set-mark 0x00001fc0/0x00001fc0
/sbin/iptables -t mangle -A in_tproxy.1.divert -j ACCEPT
/sbin/iptables -t mangle -A in_tproxy.1 -p tcp -j TPROXY --tproxy-mark 0x00001fc0/0x00001fc0 --on-port 3128
/bin/ip -f inet rule del lookup 241
/bin/ip -f inet route flush table 241
/bin/ip -f inet rule add from all fwmark 0x00001fc0/0x00001fc0 lookup 241
/bin/ip -f inet route add local default dev lo table 241
/bin/ip -f inet6 rule del lookup 241
/bin/ip -f inet6 route flush table 241
/bin/ip -f inet6 rule add from all fwmark 0x00001fc0/0x00001fc0 lookup 241
/bin/ip -f inet6 route add local default dev lo table 241
/sbin/sysctl -w net.ipv4.conf.default.rp_filter=0
/sbin/sysctl -w net.ipv4.conf.all.rp_filter=0
/sbin/sysctl -w net.ipv4.conf.lo.rp_filter=0
```

---

## Theory

The documentation at http://wiki.squid-cache.org/Features/Tproxy4 says:

```bash
iptables -t mangle -N DIVERT
iptables -t mangle -A DIVERT -j MARK --set-mark 1
iptables -t mangle -A DIVERT -j ACCEPT
```

Use DIVERT to prevent existing connections going through TPROXY twice:

```bash
iptables  -t mangle -A PREROUTING -p tcp -m socket -j DIVERT
```

Mark all other (new) packets and use TPROXY to pass into Squid:

```bash
iptables  -t mangle -A PREROUTING -p tcp --dport 80 -j TPROXY --tproxy-mark 0x1/0x1 --on-port 3129
```

## What FireHOL does

1. It creates a new chain for DIVERT called `in_tproxy.1.divert`. In this there are two statements: a mark was applied (`-j MARK --set-mark 0x00001fc0/0x00001fc0`) and ACCEPTed.

 ```bash
/sbin/iptables -t mangle -N in_tproxy.1.divert
/sbin/iptables -t mangle -A in_tproxy.1.divert -j MARK --set-mark 0x00001fc0/0x00001fc0
/sbin/iptables -t mangle -A in_tproxy.1.divert -j ACCEPT
```

2. The PREROUTING traffic is sent to `in_tproxy.1` with this:

 ```bash
/sbin/iptables -t mangle -A PREROUTING -i eth0 -p tcp --dport 80 -j in_tproxy.1
```

3. Then on `in_tproxy.1` the following are applied:

 ```bash
/sbin/iptables -t mangle -A in_tproxy.1 -p tcp -m socket -j in_tproxy.1.divert
/sbin/iptables -t mangle -A in_tproxy.1 -p tcp -j TPROXY --tproxy-mark 0x00001fc0/0x00001fc0 --on-port 3128
```

FireHOL also generates the `ip` statements required. It supports these global variables:

```bash
FIREHOL_TPROXY_MARK=
FIREHOL_TPROXY_IP_ROUTE_TABLE="241"
FIREHOL_TPROXY_ROUTE_DEVICE="lo"
```

The only difference that I see is that the examples on the squid wiki use `FIREHOL_TPROXY_ROUTE_DEVICE="eth0"`. I don't know if this will make a difference.

Could you please test it?

**Comment by dtouzeau** [comment]
*Squid proxy is installed on the same box and It generates error:*

    The following error was encountered while trying to retrieve the URL: http://www.ibm.com/
    Connection to 23.202.139.219 failed.
    The system returned: (110) Connection timed out

**You can see in my configuration: I'm using SSL in "transparent" mode and not TProxy
Using SSL rules + Proxy working like a charme.**

    version 5
    #Trusted Networks
    # eth0: 192.168.1.229 - eth1: 10.28.0.1
    FIREHOL_AUTOSAVE="/home/artica/firewall/firehol-saved-ipv4.txt"
    FIREHOL_LOG_PREFIX="FIREHOL:"
    FIREHOL_TPROXY_MARK="0xffff"
    FIREHOL_TPROXY_IP_ROUTE_TABLE="999"
    FIREHOL_TPROXY_ROUTE_DEVICE="eth0"

    ipv4 ipset create proxy_white_ssl hash:ip
    ipv4 ipset addfile proxy_white_ssl ips proxy_ssl_whitelist

    transparent_proxy 443 3130 squid
    tproxy 80 port 3128 src not "192.168.1.229 10.28.0.1"

    interface4 lo NETlo
            client all accept
            policy accept
    
    
    interface4 eth0 NETeth0
            client all accept
            policy accept


    interface4 eth1 NETeth1
            client all accept
            policy accept
    
    router4 eth12eth0 inface eth1 outface eth0
            masquerade
            server dhcp deny
            route all accept
            client all accept

    router4 eth02eth1 inface eth0 outface eth1
            server dhcp deny
            route all accept
            client all accept
    
    router4 lo2lo inface lo outface lo
          route all accept
           client all accept
           policy accept
    router4 eth02eth0 inface eth0 outface eth0
            route all accept
            client all accept
            policy accept
    router4 eth12eth1 inface eth1 outface eth1
            route all accept
            client all accept
            policy accept

**Comment by ktsaou** [comment]
@dtouzeau transparent_proxy is stable. We know it works.

tproxy on the other hand is a new feature.

Could you please configure tproxy like this:

```bash
FIREHOL_TPROXY_ROUTE_DEVICE="eth0"
tproxy 80 port 3128 inface eth0
```

and try it?
According to the docs, the above, without a `transparent_proxy` statement in your config, it should work too.

Thanks!

**Comment by dtouzeau** [comment]
This is what i said, transparent_proxy is *working*, using 
    FIREHOL_TPROXY_ROUTE_DEVICE="eth0"
    tproxy 80 port 3128 inface eth0 
Proxy still get timed out while trying to be connected to the remote web server

*You will find here the tcpdump from a node 192.168.1.32 -> gateway 192.168.1.229*
    root@routeur:~# tcpdump port 80 -v
tcpdump: listening on eth0, link-type EN10MB (Ethernet), capture size 65535 bytes
    18:22:32.624923 IP (tos 0x0, ttl 64, id 63438, offset 0, flags [DF], proto TCP (6), length 2960) a23-202-139-219.deploy.static.akamaitechnologies.com.http > 192.168.1.38.50371: Flags [.], cksum 0x70f6 (incorrect -> 0x2d7b), seq 2345088564:2345091484, ack 3214565895, win 1317, length 2920
    18:22:32.624944 IP (tos 0x0, ttl 64, id 63440, offset 0, flags [DF], proto TCP (6), length 1393) a23-202-139-219.deploy.static.akamaitechnologies.com.http > 192.168.1.38.50371: Flags [P.], cksum 0x6ad7 (incorrect -> 0x851d), seq 2920:4273, ack 1, win 1317, length 1353
    18:22:32.625114 IP (tos 0x0, ttl 128, id 14292, offset 0, flags [DF], proto TCP (6), length 40) 192.168.1.38.50371 > a23-202-139-219.deploy.static.akamaitechnologies.com.http: Flags [.], cksum 0x561e (correct), ack 2920, win 16425, length 0
    18:22:32.625144 IP (tos 0x0, ttl 64, id 63441, offset 0, flags [DF], proto TCP (6), length 4420) a23-202-139-219.deploy.static.akamaitechnologies.com.http > 192.168.1.38.50371: Flags [.], cksum 0x76aa (incorrect -> 0x5a9b), seq 4273:8653, ack 1, win 1317, length 4380
    18:22:32.625215 IP (tos 0x0, ttl 128, id 14293, offset 0, flags [DF], proto TCP (6), length 40) 192.168.1.38.50371 > a23-202-139-219.deploy.static.akamaitechnologies.com.http: Flags [.], cksum 0x4b21 (correct), ack 5733, win 16425, length 0
    18:22:32.625228 IP (tos 0x0, ttl 64, id 63444, offset 0, flags [DF], proto TCP (6), length 227) a23-202-139-219.deploy.static.akamaitechnologies.com.http > 192.168.1.38.50371: Flags [P.], cksum 0x6649 (incorrect -> 0x06d6), seq 8653:8840, ack 1, win 1317, length 187
    18:22:32.625235 IP (tos 0x0, ttl 128, id 14294, offset 0, flags [DF], proto TCP (6), length 40) 192.168.1.38.50371 > a23-202-139-219.deploy.static.akamaitechnologies.com.http: Flags [.], cksum 0x3fb9 (correct), ack 8653, win 16425, length 0
    18:22:32.636215 IP (tos 0x0, ttl 128, id 14295, offset 0, flags [DF], proto TCP (6), length 1152) 192.168.1.38.50371 > a23-202-139-219.deploy.static.akamaitechnologies.com.http: Flags [P.], cksum 0xb65c (correct), seq 1:1113, ack 8840, win 16378, length 1112
    18:22:32.636243 IP (tos 0x0, ttl 64, id 63445, offset 0, flags [DF], proto TCP (6), length 40) a23-202-139-219.deploy.static.akamaitechnologies.com.http > 192.168.1.38.50371: Flags [.], cksum 0x658e (incorrect -> 0x751f), ack 1113, win 1456, length 0
    18:22:32.650243 IP (tos 0x0, ttl 64, id 63446, offset 0, flags [DF], proto TCP (6), length 363) a23-202-139-219.deploy.static.akamaitechnologies.com.http > 192.168.1.38.50371: Flags [P.], cksum 0x66d1 (incorrect -> 0x2815), seq 8840:9163, ack 1113, win 1456, length 323
    18:22:32.704173 IP (tos 0x0, ttl 128, id 14297, offset 0, flags [DF], proto TCP (6), length 1077) 192.168.1.38.50371 > a23-202-139-219.deploy.static.akamaitechnologies.com.http: Flags [P.], cksum 0xd2ef (correct), seq 1113:2150, ack 9163, win 16297, length 1037
    18:22:32.718497 IP (tos 0x0, ttl 64, id 38914, offset 0, flags [DF], proto TCP (6), length 60) 192.168.1.229.50125 > a23-202-139-219.deploy.static.akamaitechnologies.com.http: Flags [S], cksum 0x6661 (incorrect -> 0x7e0a), seq 3395621080, win 14600, options [mss 1460,sackOK,TS val 42502362 ecr 0,nop,wscale 4], length 0
    18:22:32.718788 IP (tos 0x0, ttl 64, id 0, offset 0, flags [DF], proto TCP (6), length 60) a23-202-139-219.deploy.static.akamaitechnologies.com.http > 192.168.1.229.50125: Flags [S.], cksum 0xac77 (correct), seq 3232945637, ack 3395621081, win 14480, options [mss 1460,sackOK,TS val 73348862 ecr 42502362,nop,wscale 8], length 0
    18:22:32.718800 IP (tos 0x0, ttl 63, id 0, offset 0, flags [DF], proto TCP (6), length 60) a23-202-139-219.deploy.static.akamaitechnologies.com.http > 192.168.1.38.50125: Flags [S.], cksum 0xad36 (correct), seq 3232945637, ack 3395621081, win 14480, options [mss 1460,sackOK,TS val 73348862 ecr 42502362,nop,wscale 8], length 0
    18:22:32.718897 IP (tos 0x0, ttl 128, id 14298, offset 0, flags [DF], proto TCP (6), length 40) 192.168.1.38.50125 > a23-202-139-219.deploy.static.akamaitechnologies.com.http: Flags [R], cksum 0xcfd1 (correct), seq 3395621081, win 0, length 0
    18:22:32.744152 IP (tos 0x0, ttl 64, id 63447, offset 0, flags [DF], proto TCP (6), length 40) a23-202-139-219.deploy.static.akamaitechnologies.com.http > 192.168.1.38.50371: Flags [.], cksum 0x658e (incorrect -> 0x6f44), ack 2150, win 1595, length 0
    18:22:33.716232 IP (tos 0x0, ttl 64, id 38915, offset 0, flags [DF], proto TCP (6), length 60) 192.168.1.229.50125 > a23-202-139-219.deploy.static.akamaitechnologies.com.http: Flags [S], cksum 0x6661 (incorrect -> 0x7d10), seq 3395621080, win 14600, options [mss 1460,sackOK,TS val 42502612 ecr 0,nop,wscale 4], length 0
    18:22:33.733209 IP (tos 0x0, ttl 64, id 0, offset 0, flags [DF], proto TCP (6), length 60) a23-202-139-219.deploy.static.akamaitechnologies.com.http > 192.168.1.229.50125: Flags [S.], cksum 0xab7b (correct), seq 3232945637, ack 3395621081, win 14480, options [mss 1460,sackOK,TS val 73349114 ecr 42502362,nop,wscale 8], length 0
    18:22:33.733242 IP (tos 0x0, ttl 63, id 0, offset 0, flags [DF], proto TCP (6), length 60) a23-202-139-219.deploy.static.akamaitechnologies.com.http > 192.168.1.38.50125: Flags [S.], cksum 0xac3a (correct), seq 3232945637, ack 3395621081, win 14480, options [mss 1460,sackOK,TS val 73349114 ecr 42502362,nop,wscale 8], length 0
    18:22:33.733357 IP (tos 0x0, ttl 128, id 14300, offset 0, flags [DF], proto TCP (6), length 40) 192.168.1.38.50125 > a23-202-139-219.deploy.static.akamaitechnologies.com.http: Flags [R], cksum 0xcfd1 (correct), seq 3395621081, win 0, length 0
    18:22:33.923437 IP (tos 0x0, ttl 64, id 0, offset 0, flags [DF], proto TCP (6), length 60) a23-202-139-219.deploy.static.akamaitechnologies.com.http > 192.168.1.229.50125: Flags [S.], cksum 0xab4b (correct), seq 3232945637, ack 3395621081, win 14480, options [mss 1460,sackOK,TS val 73349162 ecr 42502362,nop,wscale 8], length 0
    18:22:33.923472 IP (tos 0x0, ttl 63, id 0, offset 0, flags [DF], proto TCP (6), length 60) a23-202-139-219.deploy.static.akamaitechnologies.com.http > 192.168.1.38.50125: Flags [S.], cksum 0xac0a (correct), seq 3232945637, ack 3395621081, win 14480, options [mss 1460,sackOK,TS val 73349162 ecr 42502362,nop,wscale 8], length 0
    18:22:33.923615 IP (tos 0x0, ttl 128, id 14301, offset 0, flags [DF], proto TCP (6), length 40) 192.168.1.38.50125 > a23-202-139-219.deploy.static.akamaitechnologies.com.http: Flags [R], cksum 0xcfd1 (correct), seq 3395621081, win 0, length 0
    18:22:35.720202 IP (tos 0x0, ttl 64, id 38916, offset 0, flags [DF], proto TCP (6), length 60) 192.168.1.229.50125 > a23-202-139-219.deploy.static.akamaitechnologies.com.http: Flags [S], cksum 0x6661 (incorrect -> 0x7b1b), seq 3395621080, win 14600, options [mss 1460,sackOK,TS val 42503113 ecr 0,nop,wscale 4], length 0
    18:22:35.720508 IP (tos 0x0, ttl 64, id 0, offset 0, flags [DF], proto TCP (6), length 60) a23-202-139-219.deploy.static.akamaitechnologies.com.http > 192.168.1.229.50125: Flags [S.], cksum 0xa988 (correct), seq 3232945637, ack 3395621081, win 14480, options [mss 1460,sackOK,TS val 73349613 ecr 42502362,nop,wscale 8], length 0
    18:22:35.720524 IP (tos 0x0, ttl 63, id 0, offset 0, flags [DF], proto TCP (6), length 60) a23-202-139-219.deploy.static.akamaitechnologies.com.http > 192.168.1.38.50125: Flags [S.], cksum 0xaa47 (correct), seq 3232945637, ack 3395621081, win 14480, options [mss 1460,sackOK,TS val 73349613 ecr 42502362,nop,wscale 8], length 0
    18:22:35.720630 IP (tos 0x0, ttl 128, id 14303, offset 0, flags [DF], proto TCP (6), length 40) 192.168.1.38.50125 > a23-202-139-219.deploy.static.akamaitechnologies.com.http: Flags [R], cksum 0xcfd1 (correct), seq 3395621081, win 0, length 0
    18:22:35.916121 IP (tos 0x0, ttl 64, id 0, offset 0, flags [DF], proto TCP (6), length 60) a23-202-139-219.deploy.static.akamaitechnologies.com.http > 192.168.1.229.50125: Flags [S.], cksum 0xa957 (correct), seq 3232945637, ack 3395621081, win 14480, options [mss 1460,sackOK,TS val 73349662 ecr 42502362,nop,wscale 8], length 0
    18:22:35.916157 IP (tos 0x0, ttl 63, id 0, offset 0, flags [DF], proto TCP (6), length 60) a23-202-139-219.deploy.static.akamaitechnologies.com.http > 192.168.1.38.50125: Flags [S.], cksum 0xaa16 (correct), seq 3232945637, ack 3395621081, win 14480, options [mss 1460,sackOK,TS val 73349662 ecr 42502362,nop,wscale 8], length 0
    18:22:35.916298 IP (tos 0x0, ttl 128, id 14304, offset 0, flags [DF], proto TCP (6), length 40) 192.168.1.38.50125 > a23-202-139-219.deploy.static.akamaitechnologies.com.http: Flags [R], cksum 0xcfd1 (correct), seq 3395621081, win 0, length 0
    18:22:39.732187 IP (tos 0x0, ttl 64, id 38917, offset 0, flags [DF], proto TCP (6), length 60) 192.168.1.229.50125 > a23-202-139-219.deploy.static.akamaitechnologies.com.http: Flags [S], cksum 0x6661 (incorrect -> 0x7730), seq 3395621080, win 14600, options [mss 1460,sackOK,TS val 42504116 ecr 0,nop,wscale 4], length 0
    18:22:39.732432 IP (tos 0x0, ttl 64, id 0, offset 0, flags [DF], proto TCP (6), length 60) a23-202-139-219.deploy.static.akamaitechnologies.com.http > 192.168.1.229.50125: Flags [S.], cksum 0xa59d (correct), seq 3232945637, ack 3395621081, win 14480, options [mss 1460,sackOK,TS val 73350616 ecr 42502362,nop,wscale 8], length 0
    18:22:39.732446 IP (tos 0x0, ttl 63, id 0, offset 0, flags [DF], proto TCP (6), length 60) a23-202-139-219.deploy.static.akamaitechnologies.com.http > 192.168.1.38.50125: Flags [S.], cksum 0xa65c (correct), seq 3232945637, ack 3395621081, win 14480, options [mss 1460,sackOK,TS val 73350616 ecr 42502362,nop,wscale 8], length 0
    18:22:39.732548 IP (tos 0x0, ttl 128, id 14306, offset 0, flags [DF], proto TCP (6), length 40) 192.168.1.38.50125 > a23-202-139-219.deploy.static.akamaitechnologies.com.http: Flags [R], cksum 0xcfd1 (correct), seq 3395621081, win 0, length 0
    18:22:40.115975 IP (tos 0x0, ttl 64, id 0, offset 0, flags [DF], proto TCP (6), length 60) a23-202-139-219.deploy.static.akamaitechnologies.com.http > 192.168.1.229.50125: Flags [S.], cksum 0xa53d (correct), seq 3232945637, ack 3395621081, win 14480, options [mss 1460,sackOK,TS val 73350712 ecr 42502362,nop,wscale 8], length 0
    18:22:40.116000 IP (tos 0x0, ttl 63, id 0, offset 0, flags [DF], proto TCP (6), length 60) a23-202-139-219.deploy.static.akamaitechnologies.com.http > 192.168.1.38.50125: Flags [S.], cksum 0xa5fc (correct), seq 3232945637, ack 3395621081, win 14480, options [mss 1460,sackOK,TS val 73350712 ecr 42502362,nop,wscale 8], length 0
    18:22:40.116122 IP (tos 0x0, ttl 128, id 14307, offset 0, flags [DF], proto TCP (6), length 40) 192.168.1.38.50125 > a23-202-139-219.deploy.static.akamaitechnologies.com.http: Flags [R], cksum 0xcfd1 (correct), seq 3395621081, win 0, length 0
    18:22:47.748163 IP (tos 0x0, ttl 64, id 38918, offset 0, flags [DF], proto TCP (6), length 60) 192.168.1.229.50125 > a23-202-139-219.deploy.static.akamaitechnologies.com.http: Flags [S], cksum 0x6661 (incorrect -> 0x6f5c), seq 3395621080, win 14600, options [mss 1460,sackOK,TS val 42506120 ecr 0,nop,wscale 4], length 0
    18:22:47.748277 IP (tos 0x0, ttl 64, id 0, offset 0, flags [DF], proto TCP (6), length 60) a23-202-139-219.deploy.static.akamaitechnologies.com.http > 192.168.1.229.50125: Flags [S.], cksum 0x9dc9 (correct), seq 3232945637, ack 3395621081, win 14480, options [mss 1460,sackOK,TS val 73352620 ecr 42502362,nop,wscale 8], length 0
    18:22:47.748287 IP (tos 0x0, ttl 63, id 0, offset 0, flags [DF], proto TCP (6), length 60) a23-202-139-219.deploy.static.akamaitechnologies.com.http > 192.168.1.38.50125: Flags [S.], cksum 0x9e88 (correct), seq 3232945637, ack 3395621081, win 14480, options [mss 1460,sackOK,TS val 73352620 ecr 42502362,nop,wscale 8], length 0
    18:22:47.748449 IP (tos 0x0, ttl 128, id 14309, offset 0, flags [DF], proto TCP (6), length 40) 192.168.1.38.50125 > a23-202-139-219.deploy.static.akamaitechnologies.com.http: Flags [R], cksum 0xcfd1 (correct), seq 3395621081, win 0, length 0
    18:23:03.780174 IP (tos 0x0, ttl 64, id 38919, offset 0, flags [DF], proto TCP (6), length 60) 192.168.1.229.50125 > a23-202-139-219.deploy.static.akamaitechnologies.com.http: Flags [S], cksum 0x6661 (incorrect -> 0x5fb4), seq 3395621080, win 14600, options [mss 1460,sackOK,TS val 42510128 ecr 0,nop,wscale 4], length 0
    18:23:03.780445 IP (tos 0x0, ttl 64, id 0, offset 0, flags [DF], proto TCP (6), length 60) a23-202-139-219.deploy.static.akamaitechnologies.com.http > 192.168.1.229.50125: Flags [S.], cksum 0x6a3b (correct), seq 3718299271, ack 3395621081, win 14480, options [mss 1460,sackOK,TS val 73356628 ecr 42510128,nop,wscale 8], length 0
    18:23:03.780464 IP (tos 0x0, ttl 63, id 0, offset 0, flags [DF], proto TCP (6), length 60) a23-202-139-219.deploy.static.akamaitechnologies.com.http > 192.168.1.38.50125: Flags [S.], cksum 0x6afa (correct), seq 3718299271, ack 3395621081, win 14480, options [mss 1460,sackOK,TS val 73356628 ecr 42510128,nop,wscale 8], length 0
    18:23:03.780758 IP (tos 0x0, ttl 128, id 14316, offset 0, flags [DF], proto TCP (6), length 40) 192.168.1.38.50125 > a23-202-139-219.deploy.static.akamaitechnologies.com.http: Flags [R], cksum 0xcfd1 (correct), seq 3395621081, win 0, length 0
    18:23:04.979190 IP (tos 0x0, ttl 64, id 0, offset 0, flags [DF], proto TCP (6), length 60) a23-202-139-219.deploy.static.akamaitechnologies.com.http > 192.168.1.229.50125: Flags [S.], cksum 0x690f (correct), seq 3718299271, ack 3395621081, win 14480, options [mss 1460,sackOK,TS val 73356928 ecr 42510128,nop,wscale 8], length 0
    18:23:04.979242 IP (tos 0x0, ttl 63, id 0, offset 0, flags [DF], proto TCP (6), length 60) a23-202-139-219.deploy.static.akamaitechnologies.com.http > 192.168.1.38.50125: Flags [S.], cksum 0x69ce (correct), seq 3718299271, ack 3395621081, win 14480, options [mss 1460,sackOK,TS val 73356928 ecr 42510128,nop,wscale 8], length 0
    18:23:04.979397 IP (tos 0x0, ttl 128, id 14317, offset 0, flags [DF], proto TCP (6), length 40) 192.168.1.38.50125 > a23-202-139-219.deploy.static.akamaitechnologies.com.http: Flags [R], cksum 0xcfd1 (correct), seq 3395621081, win 0, length 0
    18:23:06.979132 IP (tos 0x0, ttl 64, id 0, offset 0, flags [DF], proto TCP (6), length 60) a23-202-139-219.deploy.static.akamaitechnologies.com.http > 192.168.1.229.50125: Flags [S.], cksum 0x671b (correct), seq 3718299271, ack 3395621081, win 14480, options [mss 1460,sackOK,TS val 73357428 ecr 42510128,nop,wscale 8], length 0
    18:23:06.979161 IP (tos 0x0, ttl 63, id 0, offset 0, flags [DF], proto TCP (6), length 60) a23-202-139-219.deploy.static.akamaitechnologies.com.http > 192.168.1.38.50125: Flags [S.], cksum 0x67da (correct), seq 3718299271, ack 3395621081, win 14480, options [mss 1460,sackOK,TS val 73357428 ecr 42510128,nop,wscale 8], length 0
    18:23:06.979284 IP (tos 0x0, ttl 128, id 14318, offset 0, flags [DF], proto TCP (6), length 40) 192.168.1.38.50125 > a23-202-139-219.deploy.static.akamaitechnologies.com.http: Flags [R], cksum 0xcfd1 (correct), seq 3395621081, win 0, length 0
    18:23:10.979019 IP (tos 0x0, ttl 64, id 0, offset 0, flags [DF], proto TCP (6), length 60) a23-202-139-219.deploy.static.akamaitechnologies.com.http > 192.168.1.229.50125: Flags [S.], cksum 0x6333 (correct), seq 3718299271, ack 3395621081, win 14480, options [mss 1460,sackOK,TS val 73358428 ecr 42510128,nop,wscale 8], length 0
    18:23:10.979053 IP (tos 0x0, ttl 63, id 0, offset 0, flags [DF], proto TCP (6), length 60) a23-202-139-219.deploy.static.akamaitechnologies.com.http > 192.168.1.38.50125: Flags [S.], cksum 0x63f2 (correct), seq 3718299271, ack 3395621081, win 14480, options [mss 1460,sackOK,TS val 73358428 ecr 42510128,nop,wscale 8], length 0
    18:23:10.979197 IP (tos 0x0, ttl 128, id 14320, offset 0, flags [DF], proto TCP (6), length 40) 192.168.1.38.50125 > a23-202-139-219.deploy.static.akamaitechnologies.com.http: Flags [R], cksum 0xcfd1 (correct), seq 3395621081, win 0, length 0

**Comment by ktsaou** [comment]
@dtouzeau 
David this tcpdump shows communication in both directions.

Does squid complain about something?

**Comment by dtouzeau** [comment]
The following error was encountered while trying to retrieve the URL: http://www.ibm.com/
Connection to 23.202.139.219 failed.
The system returned: (110) Connection timed out

**Comment by ktsaou** [comment]
@dtouzeau Thank you for your support.

According to the squid wiki, when there are timeouts, there must be something wrong in routing.

Could please post these:

```bash
# ip rule show
# ip route show
# ip route show table 241 (or 999 depending on your FIREHOL_TPROXY_IP_ROUTE_TABLE)
```

Thanks!

**Comment by dtouzeau** [comment]
root@routeur:~# ip rule show
0:      from all lookup local
32765:  from all fwmark 0xffff lookup 999
32766:  from all lookup main
32767:  from all lookup default

ip route show
default via 192.168.1.1 dev eth0  metric 1
10.28.0.0/24 dev eth1  proto kernel  scope link  src 10.28.0.1
127.0.0.1 dev lo  scope link
192.168.1.0/24 dev eth0  proto kernel  scope link  src 192.168.1.229
192.168.1.1 dev eth0  scope link

root@routeur:~# ip route show table 999
local default dev eth0  scope host

**Comment by ktsaou** [comment]
@dtouzeau it seems right.

I will try to setup tproxy on my own to find out what is wrong.

Thanks David.

**Comment by dtouzeau** [comment]
Any updates ?

**Comment by ktsaou** [comment]
Well, I have spend several hours trying to make TPROXY work. Even without firehol. Plain vanilla iptables statements.

The situation is this:

1. squid does get the requests
2. squid does send the requests to the web servers
3. the servers do reply properly
4. the replies are sent to the client bypassing squid - the client ignores them since they do not match its TCP/IP socket details

According to the wiki page at http://wiki.squid-cache.org/Features/Tproxy4:

---

### Traffic going through Squid but the timing out

This is usually seen when the network design prevents packets coming back to Squid.

- Check that the Routing portion of the config above is set correctly.
- Check that the DIVERT is done before TPROXY rules in iptables PREROUTING chain.

---

Well, I checked these things over and over again. I cannot find the problem.

So, if anyone is willing to help, please do so...

**Comment by dlakelan** [comment]
What is the status of TPROXY support. I tried to add some vanilla iptables statements at the top of my firehol script as per the squid-cache website, but got bupkis, it seemed like no-one connected to the squid, and basically everything went into a black hole. Here's what I put at the top of my firehol.conf


### for transparent squid proxy

# IPv4-only
ip -f inet rule add fwmark 0xb8 lookup 100
ip -f inet route add local default dev lo table 100

# IPv6-only
ip -f inet6 rule add fwmark 0xb8 lookup 100
ip -f inet6 route add local default dev lo table 100

for table in iptables ip6tables; do
    $table -t mangle -N DIVERT
    $table -t mangle -A DIVERT -j MARK --set-mark 0xb8
    $table -t mangle -A DIVERT -j ACCEPT
    $table  -t mangle -A PREROUTING -p tcp -m socket -j DIVERT
    $table  -t mangle -A PREROUTING -p tcp --dport 80 -j TPROXY --tproxy-mark 0xb8/0xb8 --on-port 3129
    $table  -t mangle -A PREROUTING -p tcp --dport 443 -j TPROXY --tproxy-mark 0xb8/0xb8 --on-port 3129
done

and in squid.conf it's got:
http_port 3129 tproxy
